{
  "$schema": "https://json-schema.org/draft/2020-12/schema",
  "$id": "https://tenriff.local/schema/tenriff-skin-v1.json",
  "title": "TenRiff Skin",
  "type": "object",
  "additionalProperties": false,
  "required": ["format", "version", "name"],
  "$defs": {
    "assetPath": {
      "type": "string",
      "description": "Path relative to skin.json. Empty means use the built-in fallback."
    },
    "laneAssets": {
      "oneOf": [
        { "$ref": "#/$defs/assetPath" },
        {
          "type": "array",
          "minItems": 1,
          "maxItems": 16,
          "items": { "$ref": "#/$defs/assetPath" }
        }
      ]
    },
    "layoutRect": {
      "type": "array",
      "description": "[left, top, right, bottom] in the 1920x1080 base coordinate space.",
      "minItems": 4,
      "maxItems": 4,
      "items": { "type": "number", "minimum": -8192.0, "maximum": 8192.0 }
    }
  },
  "properties": {
    "$schema": { "type": "string" },
    "format": { "const": "tenriff-skin" },
    "version": { "const": 1 },
    "name": { "type": "string", "minLength": 1, "maxLength": 128 },
    "author": { "type": "string", "maxLength": 128 },
    "lobby": {
      "type": "object",
      "additionalProperties": false,
      "properties": {
        "background": { "$ref": "#/$defs/assetPath" },
        "logo": { "$ref": "#/$defs/assetPath" },
        "background_opacity": { "type": "number", "minimum": 0.0, "maximum": 1.0 }
      }
    },
    "layout": {
      "type": "object",
      "description": "Moves built-in menu rects. Omitted slots keep their default position.",
      "additionalProperties": false,
      "properties": {
        "title": {
          "type": "object",
          "additionalProperties": false,
          "properties": {
            "spectrum": { "$ref": "#/$defs/layoutRect" },
            "logo": { "$ref": "#/$defs/layoutRect" },
            "buttons": { "$ref": "#/$defs/layoutRect" },
            "guide": { "$ref": "#/$defs/layoutRect" },
            "footer": { "$ref": "#/$defs/layoutRect" }
          }
        },
        "song_select": {
          "type": "object",
          "additionalProperties": false,
          "properties": {
            "top_bar": { "$ref": "#/$defs/layoutRect" },
            "logo": { "$ref": "#/$defs/layoutRect" },
            "nav": { "$ref": "#/$defs/layoutRect" },
            "profile": { "$ref": "#/$defs/layoutRect" },
            "left_panel": { "$ref": "#/$defs/layoutRect" },
            "center_panel": { "$ref": "#/$defs/layoutRect" },
            "right_panel": { "$ref": "#/$defs/layoutRect" },
            "bottom_bar": { "$ref": "#/$defs/layoutRect" }
          }
        }
      }
    },
    "gameplay": {
      "type": "object",
      "additionalProperties": false,
      "properties": {
        "background": { "$ref": "#/$defs/assetPath" },
        "background_opacity": { "type": "number", "minimum": 0.0, "maximum": 1.0 },
        "gear": { "$ref": "#/$defs/assetPath" },
        "note": { "$ref": "#/$defs/laneAssets" },
        "hold_head": { "$ref": "#/$defs/laneAssets" },
        "hold_body": { "$ref": "#/$defs/laneAssets" },
        "hold_tail": { "$ref": "#/$defs/laneAssets" },
        "key_idle": { "$ref": "#/$defs/laneAssets" },
        "key_pressed": { "$ref": "#/$defs/laneAssets" },
        "note_width_ratio": { "type": "number", "minimum": 0.1, "maximum": 4.0 },
        "note_height_ratio": { "type": "number", "minimum": 0.1, "maximum": 4.0 },
        "note_aspect": {
          "description": "How note art fills its lane rect. 'width' keeps arrows square.",
          "enum": ["stretch", "contain", "width"]
        },
        "note_rotations": {
          "description": "Per-lane note rotation in degrees clockwise.",
          "type": "array",
          "maxItems": 16,
          "items": { "type": "number" }
        },
        "key_rotations": {
          "description": "Per-lane receptor rotation in degrees. Omitted means follow note_rotations.",
          "type": "array",
          "maxItems": 16,
          "items": { "type": "number" }
        },
        "judgement_line_position": { "type": "number", "minimum": 0.05, "maximum": 0.98 },
        "full_lane_receptors": { "type": "boolean" },
        "column_widths": {
          "type": "array",
          "maxItems": 16,
          "items": { "type": "number", "exclusiveMinimum": 0.0 }
        },
        "column_spacings": {
          "type": "array",
          "maxItems": 15,
          "items": { "type": "number", "minimum": 0.0 }
        }
      }
    }
  }
}
